<?xml version="1.0" encoding="UTF-8"?>
<!DOCTYPE tiendaMusica SYSTEM "musica.dtd">
<tiendaMusica>
    <disco id="D001">
        <titulo>Mayeutica</titulo>
        <artista>Robe</artista>
        <año>2021</año>
        <genero>Rock Transgresivo</genero>
        <precio>20.00</precio>
        <canciones>
            <cancion numero="1">
                <titulo>Primer Movimiento</titulo>
                <duracion>6:34</duracion>
            </cancion>
            <cancion numero="2">
                <titulo>Segundo Movimiento</titulo>
                <duracion>4:34</duracion>
            </cancion>
            <cancion numero="3">
                <titulo>Tercer Movimiento</titulo>
                <duracion>8:34</duracion>
            </cancion>
        </canciones>
    </disco>
        <disco id="D002">
        <titulo>Una Odisea Musical</titulo>
        <artista>Chasis</artista>
        <año>2001</año>
        <genero>Makina</genero>
        <precio>15.00</precio>
        <canciones>
            <cancion numero="1">
                <titulo>Fly on the wings of love</titulo>
                <duracion>5:34</duracion>
            </cancion>
            <cancion numero="2">
                <titulo>Atlantis</titulo>
                <duracion>4:34</duracion>
            </cancion>
        </canciones>
    </disco>
        <disco id="D003">
        <titulo>Trilogy</titulo>
        <artista>Pont Aeri</artista>
        <año>1999</año>
        <genero>Makina / Hardcore</genero>
        <precio>18.00</precio>
        <canciones>
            <cancion numero="1">
                <titulo>Flying Free</titulo>
                <duracion>6:34</duracion>
            </cancion>
            <cancion numero="2">
                <titulo>Reaching Dreams</titulo>
                <duracion>4:34</duracion>
            </cancion>
        </canciones>
    </disco>
</tiendaMusica>